{"$schema":"https://json-schema.org/draft/2020-12/schema","type":"object","required":["profile_id","profile_version","reference_kind","lrn_id","lrn_version","resource_units","execution_frequency_assumption"],"properties":{"profile_id":{"type":"string","pattern":"^COST-[A-Z0-9-]+$"},"profile_version":{"type":"string","pattern":"^\\d+\\.\\d+\\.\\d+$"},"reference_kind":{"enum":["registered_lrn","simulation_fixture"]},"lrn_id":{"type":"string","minLength":1},"lrn_version":{"type":"string","pattern":"^\\d+\\.\\d+\\.\\d+$"},"resource_units":{"type":"object","required":["compute","payload_data_volume","network","temporary_storage","persistent_storage","external_resource_dependency","reliability_redundancy","security_overhead"],"properties":{"compute":{"type":"integer","minimum":0},"payload_data_volume":{"type":"integer","minimum":0},"network":{"type":"integer","minimum":0},"temporary_storage":{"type":"integer","minimum":0},"persistent_storage":{"type":"integer","minimum":0},"external_resource_dependency":{"type":"integer","minimum":0},"reliability_redundancy":{"type":"integer","minimum":0},"security_overhead":{"type":"integer","minimum":0}},"additionalProperties":false},"execution_frequency_assumption":{"type":"integer","minimum":1}},"additionalProperties":false}
