{
  "profile_id": "COST-LRN-CELSIUS-FAHRENHEIT-0001",
  "profile_version": "0.1.0",
  "reference_kind": "registered_lrn",
  "lrn_id": "LRN-CELSIUS-FAHRENHEIT-0001",
  "lrn_version": "0.1.0",
  "resource_units": { "compute": 1, "payload_data_volume": 1, "network": 1, "temporary_storage": 0, "persistent_storage": 0, "external_resource_dependency": 0, "reliability_redundancy": 0, "security_overhead": 1 },
  "execution_frequency_assumption": 1000
}
