{
  "profile_id": "COST-SIMULATION-HIGH-COST-0001",
  "profile_version": "0.1.0",
  "reference_kind": "simulation_fixture",
  "lrn_id": "SIMULATION-HIGH-COST-LRN-0001",
  "lrn_version": "0.1.0",
  "resource_units": { "compute": 60, "payload_data_volume": 10, "network": 15, "temporary_storage": 5, "persistent_storage": 10, "external_resource_dependency": 60, "reliability_redundancy": 15, "security_overhead": 10 },
  "execution_frequency_assumption": 1000
}
